{
  "version": 1,
  "subject": "Hello",
  "preheader": "Peek",
  "head": "<mj-style>.a{color:red}</mj-style>",
  "blocks": [
    {
      "type": "paragraph",
      "text": "Plain & simple"
    },
    {
      "type": "raw_mjml",
      "mjml": "<mj-text color=\"red\">Styled</mj-text>"
    },
    {
      "type": "button",
      "label": "Go",
      "url": "https://x.test"
    },
    {
      "type": "raw_mjml",
      "mjml": "<mj-section background-color=\"#eee\"><mj-column><mj-text>Boxed</mj-text></mj-column></mj-section>"
    },
    {
      "type": "columns",
      "columns": [
        [
          {
            "type": "image",
            "src": "https://x.test/a.png",
            "alt": "A"
          }
        ],
        [
          {
            "type": "raw_mjml",
            "mjml": "<mj-text>R <b>bold</b></mj-text>"
          }
        ]
      ]
    }
  ]
}